{
  "schema_version": "0.1",
  "source_analysis": "graceful_opening.mp3",
  "source_movement_demands": "data/choreography/graceful_opening.movement_demands_v0_1.json",
  "duration_seconds": 140.016,
  "method": {
    "type": "continuous_visual_score_with_playability_gate",
    "beats_per_window": 4,
    "principle": "music may vary continuously; required player input remains sparse and physically feasible"
  },
  "playability_gate": {
    "controller": {
      "run_speed": 4.0,
      "jump_velocity": 6.0,
      "gravity": 18.0,
      "jump_airtime_seconds": 0.6667,
      "same_height_jump_range_world": 2.6667,
      "low_transition_duration_seconds": 0.55,
      "low_transition_distance_world": 2.2,
      "max_traversable_step_height": 0.45
    },
    "design_limits": {
      "reaction_lead_seconds": 0.75,
      "min_required_action_spacing_seconds": 0.9,
      "max_required_actions_per_window": 2,
      "max_passive_step_height": 0.3,
      "max_gap_world": 2.2,
      "low_passage_max_length_world": 1.8,
      "required_input_concurrency": 1
    },
    "action_occupancy_seconds": {
      "JUMP": 0.9167,
      "SWIPE_DOWN": 0.8,
      "HOLD": 1.0,
      "TAP": 0.3
    }
  },
  "windows": [
    {
      "start": 0.0,
      "end": 2.141,
      "duration": 2.141,
      "beat_span": {
        "start_index": 0,
        "end_index": 4,
        "count": 4
      },
      "metrics": {
        "energy": 0.2299,
        "energy_delta": 0.159,
        "rhythmic_density": 0.188,
        "sustain": 0.5937,
        "accent_peak": 0.644,
        "boundary_peak": 0.0,
        "climax_peak": 0.0
      },
      "salient_times": {
        "accent": 0.279,
        "boundary": null,
        "climax": null
      },
      "visual_intent": {
        "phrase_role": "BUILD",
        "articulation": "MIXED",
        "contour": "RISE",
        "intensity": 0.2542,
        "continuity": 0.6701,
        "lift": 0.2087
      },
      "interaction_budget": {
        "max_required_actions": 2,
        "passive_spatial_change": true
      }
    },
    {
      "start": 2.141,
      "end": 3.999,
      "duration": 1.858,
      "beat_span": {
        "start_index": 4,
        "end_index": 8,
        "count": 4
      },
      "metrics": {
        "energy": 0.3502,
        "energy_delta": 0.0825,
        "rhythmic_density": 0.0769,
        "sustain": 0.6607,
        "accent_peak": 0.5522,
        "boundary_peak": 0.2899,
        "climax_peak": 0.0
      },
      "salient_times": {
        "accent": 2.438,
        "boundary": 2.5,
        "climax": null
      },
      "visual_intent": {
        "phrase_role": "SUSTAIN",
        "articulation": "LEGATO",
        "contour": "RISE",
        "intensity": 0.2386,
        "continuity": 0.7525,
        "lift": 0.1628
      },
      "interaction_budget": {
        "max_required_actions": 2,
        "passive_spatial_change": true
      }
    },
    {
      "start": 3.999,
      "end": 5.856,
      "duration": 1.857,
      "beat_span": {
        "start_index": 8,
        "end_index": 12,
        "count": 4
      },
      "metrics": {
        "energy": 0.3726,
        "energy_delta": -0.0932,
        "rhythmic_density": 0.0,
        "sustain": 0.6374,
        "accent_peak": 0.0,
        "boundary_peak": 0.0,
        "climax_peak": 0.0
      },
      "salient_times": {
        "accent": null,
        "boundary": null,
        "climax": null
      },
      "visual_intent": {
        "phrase_role": "SUSTAIN",
        "articulation": "LEGATO",
        "contour": "FALL",
        "intensity": 0.1118,
        "continuity": 0.7643,
        "lift": 0.0
      },
      "interaction_budget": {
        "max_required_actions": 2,
        "passive_spatial_change": true
      }
    },
    {
      "start": 5.856,
      "end": 7.714,
      "duration": 1.858,
      "beat_span": {
        "start_index": 12,
        "end_index": 16,
        "count": 4
      },
      "metrics": {
        "energy": 0.5966,
        "energy_delta": 0.303,
        "rhythmic_density": 0.3187,
        "sustain": 0.5206,
        "accent_peak": 0.6187,
        "boundary_peak": 1.0,
        "climax_peak": 0.9247
      },
      "salient_times": {
        "accent": 7.663,
        "boundary": 6.75,
        "climax": 7.25
      },
      "visual_intent": {
        "phrase_role": "CLIMAX",
        "articulation": "MIXED",
        "contour": "RISE",
        "intensity": 0.5833,
        "continuity": 0.5769,
        "lift": 0.6617
      },
      "interaction_budget": {
        "max_required_actions": 2,
        "passive_spatial_change": true
      }
    },
    {
      "start": 7.714,
      "end": 9.572,
      "duration": 1.858,
      "beat_span": {
        "start_index": 16,
        "end_index": 20,
        "count": 4
      },
      "metrics": {
        "energy": 0.6608,
        "energy_delta": -0.0904,
        "rhythmic_density": 0.6731,
        "sustain": 0.2792,
        "accent_peak": 0.7336,
        "boundary_peak": 0.0,
        "climax_peak": 0.0
      },
      "salient_times": {
        "accent": 9.451,
        "boundary": null,
        "climax": null
      },
      "visual_intent": {
        "phrase_role": "RELEASE",
        "articulation": "MIXED",
        "contour": "FALL",
        "intensity": 0.5469,
        "continuity": 0.2959,
        "lift": 0.1834
      },
      "interaction_budget": {
        "max_required_actions": 2,
        "passive_spatial_change": true
      }
    },
    {
      "start": 9.572,
      "end": 11.429,
      "duration": 1.857,
      "beat_span": {
        "start_index": 20,
        "end_index": 24,
        "count": 4
      },
      "metrics": {
        "energy": 0.5121,
        "energy_delta": -0.0859,
        "rhythmic_density": 0.6484,
        "sustain": 0.4428,
        "accent_peak": 0.786,
        "boundary_peak": 0.0,
        "climax_peak": 0.0
      },
      "salient_times": {
        "accent": 9.683,
        "boundary": null,
        "climax": null
      },
      "visual_intent": {
        "phrase_role": "RELEASE",
        "articulation": "ACCENTED",
        "contour": "FALL",
        "intensity": 0.5053,
        "continuity": 0.4109,
        "lift": 0.1965
      },
      "interaction_budget": {
        "max_required_actions": 2,
        "passive_spatial_change": true
      }
    },
    {
      "start": 11.429,
      "end": 13.287,
      "duration": 1.858,
      "beat_span": {
        "start_index": 24,
        "end_index": 28,
        "count": 4
      },
      "metrics": {
        "energy": 0.6717,
        "energy_delta": 0.0553,
        "rhythmic_density": 0.6539,
        "sustain": 0.4541,
        "accent_peak": 0.7731,
        "boundary_peak": 0.3436,
        "climax_peak": 0.828
      },
      "salient_times": {
        "accent": 13.166,
        "boundary": 13.0,
        "climax": 11.5
      },
      "visual_intent": {
        "phrase_role": "CLIMAX",
        "articulation": "MIXED",
        "contour": "LEVEL",
        "intensity": 0.7179,
        "continuity": 0.4163,
        "lift": 0.5825
      },
      "interaction_budget": {
        "max_required_actions": 2,
        "passive_spatial_change": true
      }
    },
    {
      "start": 13.287,
      "end": 15.145,
      "duration": 1.858,
      "beat_span": {
        "start_index": 28,
        "end_index": 32,
        "count": 4
      },
      "metrics": {
        "energy": 0.5367,
        "energy_delta": -0.0415,
        "rhythmic_density": 0.5165,
        "sustain": 0.5099,
        "accent_peak": 0.7223,
        "boundary_peak": 0.0,
        "climax_peak": 0.0
      },
      "salient_times": {
        "accent": 14.095,
        "boundary": null,
        "climax": null
      },
      "visual_intent": {
        "phrase_role": "FLOW",
        "articulation": "MIXED",
        "contour": "LEVEL",
        "intensity": 0.4604,
        "continuity": 0.5007,
        "lift": 0.1806
      },
      "interaction_budget": {
        "max_required_actions": 2,
        "passive_spatial_change": true
      }
    },
    {
      "start": 15.145,
      "end": 17.003,
      "duration": 1.858,
      "beat_span": {
        "start_index": 32,
        "end_index": 36,
        "count": 4
      },
      "metrics": {
        "energy": 0.5609,
        "energy_delta": -0.0276,
        "rhythmic_density": 0.4134,
        "sustain": 0.5645,
        "accent_peak": 0.6806,
        "boundary_peak": 0.0,
        "climax_peak": 0.0
      },
      "salient_times": {
        "accent": 16.44,
        "boundary": null,
        "climax": null
      },
      "visual_intent": {
        "phrase_role": "FLOW",
        "articulation": "MIXED",
        "contour": "LEVEL",
        "intensity": 0.4284,
        "continuity": 0.5722,
        "lift": 0.1701
      },
      "interaction_budget": {
        "max_required_actions": 2,
        "passive_spatial_change": true
      }
    },
    {
      "start": 17.003,
      "end": 18.86,
      "duration": 1.857,
      "beat_span": {
        "start_index": 36,
        "end_index": 40,
        "count": 4
      },
      "metrics": {
        "energy": 0.4728,
        "energy_delta": 0.0305,
        "rhythmic_density": 0.3736,
        "sustain": 0.5524,
        "accent_peak": 0.675,
        "boundary_peak": 0.0,
        "climax_peak": 0.0
      },
      "salient_times": {
        "accent": 18.297,
        "boundary": null,
        "climax": null
      },
      "visual_intent": {
        "phrase_role": "FLOW",
        "articulation": "MIXED",
        "contour": "LEVEL",
        "intensity": 0.3889,
        "continuity": 0.5783,
        "lift": 0.1779
      },
      "interaction_budget": {
        "max_required_actions": 2,
        "passive_spatial_change": true
      }
    },
    {
      "start": 18.86,
      "end": 20.718,
      "duration": 1.858,
      "beat_span": {
        "start_index": 40,
        "end_index": 44,
        "count": 4
      },
      "metrics": {
        "energy": 0.5417,
        "energy_delta": 0.0058,
        "rhythmic_density": 0.3407,